{
  "version": 1,
  "name": "Tower",
  "size": { "x": 9, "y": 20, "z": 9 },
  "operations": [
    { "type": "hollow_box", "from": [1, 0, 1], "to": [7, 16, 7], "block": "minecraft:stone_bricks" },
    { "type": "floor", "from": [0, 17, 0], "to": [8, 17, 8], "block": "minecraft:stone_bricks" },
    { "type": "repeat", "count": 4, "step": [2, 0, 0], "operation": { "type": "column", "at": [0, 18, 0], "height": 2, "block": "minecraft:stone_bricks" } },
    { "type": "mirror", "axis": "z", "pivot": 4, "includeOriginal": true, "operation": { "type": "repeat", "count": 4, "step": [2, 0, 0], "operation": { "type": "column", "at": [0, 18, 0], "height": 2, "block": "minecraft:stone_bricks" } } }
  ]
}
