{
  "version": 1,
  "name": "Pool",
  "size": { "x": 12, "y": 3, "z": 8 },
  "operations": [
    { "type": "hollow_box", "from": [0, 0, 0], "to": [11, 1, 7], "block": "minecraft:smooth_quartz" },
    { "type": "fill", "from": [1, 1, 1], "to": [10, 1, 6], "block": "minecraft:water" },
    { "type": "repeat", "count": 4, "step": [3, 0, 0], "operation": { "type": "set_block", "at": [1, 0, 0], "block": "minecraft:sea_lantern" } }
  ]
}
