{
  "version": 1,
  "name": "Wall",
  "size": { "x": 20, "y": 6, "z": 3 },
  "operations": [
    { "type": "fill", "from": [0, 0, 0], "to": [19, 4, 2], "block": "minecraft:stone_bricks" },
    { "type": "repeat", "count": 10, "step": [2, 0, 0], "operation": { "type": "set_block", "at": [0, 5, 0], "block": "minecraft:stone_bricks" } }
  ]
}
